{
  "schema_version": 1,
  "case_id": "versioning-copy-005",
  "capability": "versioning-and-lifecycle",
  "variant": "baseline",
  "configuration": "individual-capability",
  "timestamp": "2026-08-10T18:43:15.337Z",
  "environment": {
    "codex_cli": "codex-cli 0.146.0",
    "node": "v18.19.1",
    "platform": "linux-x64"
  },
  "metrics": {
    "input_tokens": 14265,
    "cached_input_tokens": 0,
    "output_tokens": 16,
    "total_tokens": 14281,
    "turns": 1,
    "tool_calls": 0,
    "latency_ms": 6227,
    "correction_turns": 0
  },
  "checks": [
    {
      "name": "output-schema",
      "passed": true,
      "detail": "response matches output schema"
    },
    {
      "name": "nonempty:answer",
      "passed": true,
      "detail": "answer is populated"
    },
    {
      "name": "required-term:answer:Version history",
      "passed": true,
      "detail": "answer includes Version history"
    }
  ],
  "passed": true,
  "response": {
    "answer": "Version history"
  }
}
