{
  "schema_version": 1,
  "case_id": "documentation-unrelated-006",
  "capability": "documentation",
  "variant": "baseline",
  "configuration": "individual-capability",
  "timestamp": "2026-08-10T18:43:51.720Z",
  "environment": {
    "codex_cli": "codex-cli 0.146.0",
    "node": "v18.19.1",
    "platform": "linux-x64"
  },
  "metrics": {
    "input_tokens": 14248,
    "cached_input_tokens": 0,
    "output_tokens": 15,
    "total_tokens": 14263,
    "turns": 1,
    "tool_calls": 0,
    "latency_ms": 6640,
    "correction_turns": 0
  },
  "checks": [
    {
      "name": "output-schema",
      "passed": true,
      "detail": "response matches output schema"
    },
    {
      "name": "nonempty:answer",
      "passed": true,
      "detail": "answer is populated"
    },
    {
      "name": "required-term:answer:15",
      "passed": true,
      "detail": "answer includes 15"
    }
  ],
  "passed": true,
  "response": {
    "answer": "15"
  }
}
