{
  "schema_version": 1,
  "case_id": "token-efficiency-handoff-001",
  "capability": "token-efficiency",
  "variant": "baseline",
  "configuration": "individual-capability",
  "timestamp": "2026-08-10T17:53:31.654Z",
  "environment": {
    "codex_cli": "codex-cli 0.146.0",
    "node": "v18.19.1",
    "platform": "linux-x64"
  },
  "metrics": {
    "input_tokens": 14512,
    "cached_input_tokens": 0,
    "output_tokens": 251,
    "total_tokens": 14763,
    "turns": 1,
    "tool_calls": 0,
    "latency_ms": 9755,
    "correction_turns": 0
  },
  "checks": [
    {
      "name": "output-schema",
      "passed": true,
      "detail": "response matches output schema"
    },
    {
      "name": "nonempty:decision",
      "passed": true,
      "detail": "decision is populated"
    },
    {
      "name": "nonempty:constraints",
      "passed": true,
      "detail": "constraints is populated"
    },
    {
      "name": "nonempty:verification",
      "passed": true,
      "detail": "verification is populated"
    },
    {
      "name": "nonempty:rollback",
      "passed": true,
      "detail": "rollback is populated"
    },
    {
      "name": "minimum-items:constraints",
      "passed": true,
      "detail": "constraints has 8 items"
    },
    {
      "name": "minimum-items:verification",
      "passed": true,
      "detail": "verification has 5 items"
    },
    {
      "name": "required-term:decision:retry worker",
      "passed": true,
      "detail": "decision includes retry worker"
    },
    {
      "name": "required-term:decision:retry table",
      "passed": true,
      "detail": "decision includes retry table"
    },
    {
      "name": "required-term:constraints:order_id",
      "passed": true,
      "detail": "constraints includes order_id"
    },
    {
      "name": "required-term:constraints:attempt",
      "passed": true,
      "detail": "constraints includes attempt"
    },
    {
      "name": "required-term:constraints:payment_retry_exhausted",
      "passed": true,
      "detail": "constraints includes payment_retry_exhausted"
    },
    {
      "name": "required-term:verification:30",
      "passed": true,
      "detail": "verification includes 30"
    },
    {
      "name": "required-term:verification:120",
      "passed": true,
      "detail": "verification includes 120"
    },
    {
      "name": "required-term:verification:600",
      "passed": true,
      "detail": "verification includes 600"
    },
    {
      "name": "required-term:verification:duplicate",
      "passed": true,
      "detail": "verification includes duplicate"
    },
    {
      "name": "required-term:verification:charge",
      "passed": true,
      "detail": "verification includes charge"
    },
    {
      "name": "required-term:verification:terminal",
      "passed": true,
      "detail": "verification includes terminal"
    },
    {
      "name": "required-term:rollback:payment_retry_v2",
      "passed": true,
      "detail": "rollback includes payment_retry_v2"
    }
  ],
  "passed": true,
  "response": {
    "decision": "Modify only the existing payment retry worker, retaining the retry table as the durability boundary and implementing exactly three retry attempts with delays of 30, 120, and 600 seconds. Do not introduce a queue.",
    "constraints": [
      "Change only the existing payment retry worker.",
      "Keep the existing retry table; do not add a queue or database migration.",
      "Use `order_id` plus `attempt` as the idempotency key.",
      "Allow no fourth attempt.",
      "Emit the existing `payment_retry_exhausted` metric after the terminal attempt.",
      "Do not rename the `payment_retry_exhausted` metric in this increment.",
      "Preserve the current retry-table cleanup behavior.",
      "Exclude the unrelated UI redesign from this increment."
    ],
    "verification": [
      "Unit-test the retry delay schedule: 30, 120, and 600 seconds.",
      "Unit-test that the third retry is terminal and no fourth attempt is scheduled.",
      "Integration-test duplicate delivery using the same `order_id` and `attempt`, confirming that exactly one charge occurs.",
      "Verify `payment_retry_exhausted` is emitted after the terminal attempt.",
      "Regression-test that existing retry-table cleanup behavior remains unchanged."
    ],
    "rollback": "Disable the existing `payment_retry_v2` feature flag."
  }
}
