{
  "schema_version": 1,
  "case_id": "documentation-code-004",
  "capability": "documentation",
  "variant": "baseline",
  "configuration": "individual-capability",
  "timestamp": "2026-08-10T18:42:28.380Z",
  "environment": {
    "codex_cli": "codex-cli 0.146.0",
    "node": "v18.19.1",
    "platform": "linux-x64"
  },
  "metrics": {
    "input_tokens": 14260,
    "cached_input_tokens": 0,
    "output_tokens": 16,
    "total_tokens": 14276,
    "turns": 1,
    "tool_calls": 0,
    "latency_ms": 6458,
    "correction_turns": 0
  },
  "checks": [
    {
      "name": "output-schema",
      "passed": true,
      "detail": "response matches output schema"
    },
    {
      "name": "nonempty:answer",
      "passed": true,
      "detail": "answer is populated"
    },
    {
      "name": "required-term:answer:user_id",
      "passed": true,
      "detail": "answer includes user_id"
    }
  ],
  "passed": true,
  "response": {
    "answer": "user_id"
  }
}
