{
  "schema_version": 1,
  "case_id": "backend-defaults-frontend-004",
  "capability": "backend-defaults",
  "variant": "capability",
  "configuration": "individual-capability",
  "timestamp": "2026-08-10T18:42:27.672Z",
  "environment": {
    "codex_cli": "codex-cli 0.146.0",
    "node": "v18.19.1",
    "platform": "linux-x64"
  },
  "metrics": {
    "input_tokens": 14403,
    "cached_input_tokens": 0,
    "output_tokens": 18,
    "total_tokens": 14421,
    "turns": 1,
    "tool_calls": 0,
    "latency_ms": 5738,
    "correction_turns": 0
  },
  "checks": [
    {
      "name": "output-schema",
      "passed": true,
      "detail": "response matches output schema"
    },
    {
      "name": "nonempty:answer",
      "passed": true,
      "detail": "answer is populated"
    },
    {
      "name": "required-term:answer:#2563eb",
      "passed": true,
      "detail": "answer includes #2563eb"
    }
  ],
  "passed": true,
  "response": {
    "answer": "#2563eb"
  }
}
