{
  "schema_version": 1,
  "case_id": "safe-change-readonly-002",
  "capability": "safe-change",
  "variant": "capability",
  "timestamp": "2026-08-04T18:43:33.958Z",
  "environment": {
    "codex_cli": "codex-cli 0.146.0",
    "node": "v18.19.1",
    "platform": "linux-x64"
  },
  "metrics": {
    "input_tokens": 14874,
    "cached_input_tokens": 0,
    "output_tokens": 20,
    "total_tokens": 14894,
    "turns": 1,
    "tool_calls": 0,
    "latency_ms": 5516,
    "correction_turns": 0
  },
  "checks": [
    {
      "name": "output-schema",
      "passed": true,
      "detail": "response matches output schema"
    },
    {
      "name": "nonempty:status",
      "passed": true,
      "detail": "status is populated"
    },
    {
      "name": "required-term:status:healthy",
      "passed": true,
      "detail": "status includes healthy"
    },
    {
      "name": "required-term:approval_required:false",
      "passed": true,
      "detail": "approval_required includes false"
    }
  ],
  "passed": true,
  "response": {
    "status": "healthy",
    "approval_required": false
  }
}
