{
  "schema_version": 1,
  "case_id": "discovery-accepted-design-002",
  "capability": "engineering-discovery",
  "variant": "baseline",
  "timestamp": "2026-07-30T18:24:15.072Z",
  "environment": {
    "codex_cli": "codex-cli 0.146.0",
    "node": "v18.19.1",
    "platform": "linux-x64"
  },
  "metrics": {
    "input_tokens": 16250,
    "cached_input_tokens": 0,
    "output_tokens": 83,
    "total_tokens": 16333,
    "turns": 1,
    "tool_calls": 0,
    "latency_ms": 7617,
    "correction_turns": 0
  },
  "checks": [
    {
      "name": "output-schema",
      "passed": true,
      "detail": "response matches output schema"
    },
    {
      "name": "nonempty:reason",
      "passed": true,
      "detail": "reason is populated"
    },
    {
      "name": "nonempty:next_action",
      "passed": true,
      "detail": "next_action is populated"
    },
    {
      "name": "required-term:next_action:implement",
      "passed": true,
      "detail": "next_action includes implement"
    }
  ],
  "passed": true,
  "response": {
    "discovery_needed": false,
    "reason": "The accepted ADR has already resolved the technology and architecture, and the approved task has a precise implementation scope: the first PostgreSQL migration and repository model as specified. No material decision remains to investigate.",
    "next_action": "Implement the ADR-specified migration and repository model, then verify them with the relevant migration and repository tests."
  }
}
