{
  "schema_version": 1,
  "case_id": "documentation-release-001",
  "capability": "documentation",
  "variant": "baseline",
  "configuration": "individual-capability",
  "timestamp": "2026-08-10T18:35:49.561Z",
  "environment": {
    "codex_cli": "codex-cli 0.146.0",
    "node": "v18.19.1",
    "platform": "linux-x64"
  },
  "metrics": {
    "input_tokens": 43961,
    "cached_input_tokens": 28160,
    "output_tokens": 730,
    "total_tokens": 44691,
    "turns": 1,
    "tool_calls": 0,
    "latency_ms": 26543,
    "correction_turns": 0
  },
  "checks": [
    {
      "name": "output-schema",
      "passed": true,
      "detail": "response matches output schema"
    },
    {
      "name": "nonempty:changes",
      "passed": true,
      "detail": "changes is populated"
    },
    {
      "name": "nonempty:excluded_claims",
      "passed": true,
      "detail": "excluded_claims is populated"
    },
    {
      "name": "nonempty:verification",
      "passed": true,
      "detail": "verification is populated"
    },
    {
      "name": "minimum-items:changes",
      "passed": true,
      "detail": "changes has 3 items"
    },
    {
      "name": "minimum-items:excluded_claims",
      "passed": true,
      "detail": "excluded_claims has 2 items"
    },
    {
      "name": "minimum-items:verification",
      "passed": true,
      "detail": "verification has 5 items"
    },
    {
      "name": "required-term:artifact_language:english",
      "passed": true,
      "detail": "artifact_language includes english"
    },
    {
      "name": "required-term:entry_doc_action:concise-update",
      "passed": true,
      "detail": "entry_doc_action includes concise-update"
    },
    {
      "name": "required-term:changes:doctor",
      "passed": true,
      "detail": "changes includes doctor"
    },
    {
      "name": "required-term:changes:exit",
      "passed": true,
      "detail": "changes includes exit"
    },
    {
      "name": "required-term:excluded_claims:repair",
      "passed": true,
      "detail": "excluded_claims includes repair"
    },
    {
      "name": "required-term:verification:link",
      "passed": true,
      "detail": "verification includes link"
    },
    {
      "name": "required-term:verification:status",
      "passed": true,
      "detail": "verification includes status"
    }
  ],
  "passed": true,
  "response": {
    "artifact_language": "english",
    "implementation_status": "implemented",
    "entry_doc_action": "concise-update",
    "changes": [
      "Add a concise README entry for the implemented `doctor` command and link to `docs/doctor.md`.",
      "Mention `doctor --json` as the machine-readable form, with exit status 0 for healthy results and 2 when issues are found.",
      "Keep diagnostic details and troubleshooting guidance in `docs/doctor.md` rather than duplicating them in the README."
    ],
    "excluded_claims": [
      "Do not mention or imply availability of the proposed `repair` command.",
      "Do not describe unverified remediation behavior or additional exit statuses."
    ],
    "verification": [
      "Confirm the README command spelling and examples match the implemented CLI help.",
      "Run `doctor --json` against healthy and issue-producing scenarios and confirm exit statuses 0 and 2.",
      "Verify the README link to `docs/doctor.md` resolves correctly.",
      "Check that all added prose is in English and remains concise enough for an entry document.",
      "Search the README for `repair` and ensure no availability claim was introduced."
    ]
  }
}
