{
  "schema_version": 1,
  "case_id": "backend-defaults-copy-005",
  "capability": "backend-defaults",
  "variant": "capability",
  "configuration": "individual-capability",
  "timestamp": "2026-08-10T18:43:16.626Z",
  "environment": {
    "codex_cli": "codex-cli 0.146.0",
    "node": "v18.19.1",
    "platform": "linux-x64"
  },
  "metrics": {
    "input_tokens": 14406,
    "cached_input_tokens": 0,
    "output_tokens": 16,
    "total_tokens": 14422,
    "turns": 1,
    "tool_calls": 0,
    "latency_ms": 5710,
    "correction_turns": 0
  },
  "checks": [
    {
      "name": "output-schema",
      "passed": true,
      "detail": "response matches output schema"
    },
    {
      "name": "nonempty:answer",
      "passed": true,
      "detail": "answer is populated"
    },
    {
      "name": "required-term:answer:Try again",
      "passed": true,
      "detail": "answer includes Try again"
    }
  ],
  "passed": true,
  "response": {
    "answer": "Try again"
  }
}
