{
  "schema_version": 1,
  "case_id": "versioning-promotion-003",
  "capability": "versioning-and-lifecycle",
  "variant": "baseline",
  "configuration": "individual-capability",
  "timestamp": "2026-08-10T18:40:23.823Z",
  "environment": {
    "codex_cli": "codex-cli 0.146.0",
    "node": "v18.19.1",
    "platform": "linux-x64"
  },
  "metrics": {
    "input_tokens": 43933,
    "cached_input_tokens": 28160,
    "output_tokens": 713,
    "total_tokens": 44646,
    "turns": 1,
    "tool_calls": 0,
    "latency_ms": 21318,
    "correction_turns": 0
  },
  "checks": [
    {
      "name": "output-schema",
      "passed": true,
      "detail": "response matches output schema"
    },
    {
      "name": "nonempty:rollback",
      "passed": true,
      "detail": "rollback is populated"
    },
    {
      "name": "nonempty:notice",
      "passed": true,
      "detail": "notice is populated"
    },
    {
      "name": "nonempty:evidence_required",
      "passed": true,
      "detail": "evidence_required is populated"
    },
    {
      "name": "minimum-items:evidence_required",
      "passed": true,
      "detail": "evidence_required has 3 items"
    },
    {
      "name": "required-term:classification:unknown",
      "passed": false,
      "detail": "classification omits unknown"
    },
    {
      "name": "required-term:version_effect:none",
      "passed": true,
      "detail": "version_effect includes none"
    },
    {
      "name": "required-term:status_effect:keep-current",
      "passed": true,
      "detail": "status_effect includes keep-current"
    },
    {
      "name": "required-term:evidence_required:behavior",
      "passed": true,
      "detail": "evidence_required includes behavior"
    },
    {
      "name": "required-term:evidence_required:compatibility",
      "passed": true,
      "detail": "evidence_required includes compatibility"
    },
    {
      "name": "required-term:evidence_required:blinded",
      "passed": true,
      "detail": "evidence_required includes blinded"
    }
  ],
  "passed": false,
  "response": {
    "classification": "non-breaking",
    "version_effect": "none",
    "status_effect": "keep-current",
    "consumers": [
      "policy adopters",
      "integrators",
      "maintainers"
    ],
    "migration": [],
    "rollback": "No release is performed; retain the current version and lifecycle status.",
    "notice": "Basic lifecycle operations passing does not justify stable promotion. Do not publish or mark stable until promotion evidence is complete.",
    "evidence_required": [
      "Matched behavioral comparisons against the promotion baseline",
      "Compatibility matrix covering supported environments and versions",
      "Blinded independent review of the promotion evidence"
    ]
  }
}
