{
  "schema_version": 1,
  "case_id": "token-efficiency-audit-002",
  "capability": "token-efficiency",
  "variant": "baseline",
  "configuration": "individual-capability",
  "timestamp": "2026-08-10T17:53:49.559Z",
  "environment": {
    "codex_cli": "codex-cli 0.146.0",
    "node": "v18.19.1",
    "platform": "linux-x64"
  },
  "metrics": {
    "input_tokens": 14445,
    "cached_input_tokens": 0,
    "output_tokens": 571,
    "total_tokens": 15016,
    "turns": 1,
    "tool_calls": 0,
    "latency_ms": 27646,
    "correction_turns": 0
  },
  "checks": [
    {
      "name": "output-schema",
      "passed": true,
      "detail": "response matches output schema"
    },
    {
      "name": "nonempty:findings",
      "passed": true,
      "detail": "findings is populated"
    },
    {
      "name": "minimum-items:findings",
      "passed": true,
      "detail": "findings has 6 items"
    },
    {
      "name": "required-term:findings:correctness",
      "passed": true,
      "detail": "findings includes correctness"
    },
    {
      "name": "required-term:findings:security",
      "passed": true,
      "detail": "findings includes security"
    },
    {
      "name": "required-term:findings:data",
      "passed": true,
      "detail": "findings includes data"
    },
    {
      "name": "required-term:findings:operations",
      "passed": true,
      "detail": "findings includes operations"
    },
    {
      "name": "required-term:findings:rollback",
      "passed": true,
      "detail": "findings includes rollback"
    },
    {
      "name": "required-term:findings:compatibility",
      "passed": true,
      "detail": "findings includes compatibility"
    },
    {
      "name": "required-term:findings:duplicate",
      "passed": true,
      "detail": "findings includes duplicate"
    },
    {
      "name": "required-term:findings:request body",
      "passed": true,
      "detail": "findings includes request body"
    },
    {
      "name": "required-term:findings:backfill",
      "passed": true,
      "detail": "findings includes backfill"
    },
    {
      "name": "required-term:findings:runbook",
      "passed": true,
      "detail": "findings includes runbook"
    },
    {
      "name": "required-term:findings:irreversible",
      "passed": true,
      "detail": "findings includes irreversible"
    },
    {
      "name": "required-term:findings:field name",
      "passed": true,
      "detail": "findings includes field name"
    }
  ],
  "passed": true,
  "response": {
    "findings": [
      {
        "area": "correctness",
        "evidence": "The new reconciliation path has unit test coverage, but there is no integration test covering duplicate-event delivery.",
        "risk": "Duplicate events may cause repeated reconciliation, double application of side effects, or inconsistent state in production despite the unit tests passing.",
        "remediation": "Add an integration test that delivers the same event more than once and verifies idempotent processing, including unchanged final state and no duplicated side effects."
      },
      {
        "area": "security",
        "evidence": "The callback verifies the request signature, but it logs the complete request body.",
        "risk": "Sensitive or regulated callback data may be exposed through logs, increasing unauthorized-access, retention, and compliance risk.",
        "remediation": "Stop logging complete request bodies; log only required metadata and explicitly allowlisted, redacted fields. Review access controls and retention for existing logs, and remove exposed historical data where feasible."
      },
      {
        "area": "data",
        "evidence": "The migration adds a non-null column without providing a default or a backfill plan.",
        "risk": "The migration may fail when existing rows are present, or application reads and writes may fail during a rolling deployment because old records cannot satisfy the new constraint.",
        "remediation": "Use a staged migration: add the column as nullable or with a safe default, deploy compatible application code, backfill existing rows in controlled batches, validate completion, and only then enforce the non-null constraint."
      },
      {
        "area": "operations",
        "evidence": "An alert exists for failures, but the alert contains no link to an operational runbook.",
        "risk": "Responders may take longer to diagnose and mitigate failures, increasing recovery time and the likelihood of inconsistent incident handling.",
        "remediation": "Create or update a runbook with ownership, diagnostic queries, dashboards, mitigation steps, escalation contacts, and recovery verification, then link it directly from the alert."
      },
      {
        "area": "rollback",
        "evidence": "The deployment document instructs operators to revert the release, but the associated migration is irreversible.",
        "risk": "A code rollback cannot restore the previous database state and may leave the reverted application incompatible with the migrated schema, causing extended downtime or data loss.",
        "remediation": "Define and test a forward-recovery strategy or create a safe compensating migration. Update the deployment document with the exact rollback boundary, schema compatibility requirements, backup and restore procedure, and decision criteria before release."
      },
      {
        "area": "compatibility",
        "evidence": "One consumer still reads the previous event field name while the release introduces a new field name.",
        "risk": "That consumer may receive missing or undefined data, reject events, or silently process them incorrectly after producers switch to the new field.",
        "remediation": "Provide a compatibility window in which producers emit both field names or consumers accept both, migrate and verify the remaining consumer, and remove the previous field only after usage monitoring confirms that no consumers depend on it."
      }
    ]
  }
}
