{
  "schema_version": 1,
  "case_id": "discovery-accepted-design-002",
  "capability": "engineering-discovery",
  "variant": "capability",
  "timestamp": "2026-07-30T18:24:46.634Z",
  "environment": {
    "codex_cli": "codex-cli 0.146.0",
    "node": "v18.19.1",
    "platform": "linux-x64"
  },
  "metrics": {
    "input_tokens": 16353,
    "cached_input_tokens": 0,
    "output_tokens": 72,
    "total_tokens": 16425,
    "turns": 1,
    "tool_calls": 0,
    "latency_ms": 6313,
    "correction_turns": 0
  },
  "checks": [
    {
      "name": "output-schema",
      "passed": true,
      "detail": "response matches output schema"
    },
    {
      "name": "nonempty:reason",
      "passed": true,
      "detail": "reason is populated"
    },
    {
      "name": "nonempty:next_action",
      "passed": true,
      "detail": "next_action is populated"
    },
    {
      "name": "required-term:next_action:implement",
      "passed": true,
      "detail": "next_action includes implement"
    }
  ],
  "passed": true,
  "response": {
    "discovery_needed": false,
    "reason": "The accepted ADR already fixes the technology, architecture, persistence model, and transactional claiming approach, so this is an implementation task with no unresolved engineering decision requiring discovery.",
    "next_action": "Implement the first PostgreSQL migration and repository model exactly as specified by the accepted ADR."
  }
}
