{
  "schema_version": 1,
  "case_id": "versioning-unrelated-006",
  "capability": "versioning-and-lifecycle",
  "variant": "capability",
  "configuration": "individual-capability",
  "timestamp": "2026-08-10T18:43:51.254Z",
  "environment": {
    "codex_cli": "codex-cli 0.146.0",
    "node": "v18.19.1",
    "platform": "linux-x64"
  },
  "metrics": {
    "input_tokens": 14353,
    "cached_input_tokens": 12032,
    "output_tokens": 15,
    "total_tokens": 14368,
    "turns": 1,
    "tool_calls": 0,
    "latency_ms": 5462,
    "correction_turns": 0
  },
  "checks": [
    {
      "name": "output-schema",
      "passed": true,
      "detail": "response matches output schema"
    },
    {
      "name": "nonempty:answer",
      "passed": true,
      "detail": "answer is populated"
    },
    {
      "name": "required-term:answer:south",
      "passed": true,
      "detail": "answer includes south"
    }
  ],
  "passed": true,
  "response": {
    "answer": "south"
  }
}
