{
  "schema_version": 1,
  "case_id": "documentation-language-002",
  "capability": "documentation",
  "variant": "baseline",
  "configuration": "individual-capability",
  "timestamp": "2026-08-10T18:38:36.261Z",
  "environment": {
    "codex_cli": "codex-cli 0.146.0",
    "node": "v18.19.1",
    "platform": "linux-x64"
  },
  "metrics": {
    "input_tokens": 14397,
    "cached_input_tokens": 0,
    "output_tokens": 125,
    "total_tokens": 14522,
    "turns": 1,
    "tool_calls": 0,
    "latency_ms": 8475,
    "correction_turns": 0
  },
  "checks": [
    {
      "name": "output-schema",
      "passed": true,
      "detail": "response matches output schema"
    },
    {
      "name": "nonempty:changes",
      "passed": true,
      "detail": "changes is populated"
    },
    {
      "name": "nonempty:verification",
      "passed": true,
      "detail": "verification is populated"
    },
    {
      "name": "minimum-items:changes",
      "passed": true,
      "detail": "changes has 1 items"
    },
    {
      "name": "minimum-items:verification",
      "passed": true,
      "detail": "verification has 2 items"
    },
    {
      "name": "required-term:artifact_language:english",
      "passed": true,
      "detail": "artifact_language includes english"
    },
    {
      "name": "required-term:entry_doc_action:concise-update",
      "passed": true,
      "detail": "entry_doc_action includes concise-update"
    },
    {
      "name": "required-term:changes:--dry-run",
      "passed": true,
      "detail": "changes includes --dry-run"
    },
    {
      "name": "required-term:verification:command",
      "passed": true,
      "detail": "verification includes command"
    }
  ],
  "passed": true,
  "response": {
    "artifact_language": "english",
    "implementation_status": "planned",
    "entry_doc_action": "concise-update",
    "changes": [
      "Add a concise English example using `men-of-letters install core-policies --dry-run` to the relevant entry documentation."
    ],
    "excluded_claims": [
      "Do not classify the artifact language as Portuguese; Portuguese is only the conversation language.",
      "Do not claim the example has already been implemented.",
      "Do not claim any other documentation is affected.",
      "Do not imply the dry-run writes files."
    ],
    "verification": [
      "Verified command exits with status 0.",
      "Verified command does not write files."
    ]
  }
}
