{
  "schema_version": 1,
  "case_id": "token-efficiency-handoff-001",
  "capability": "token-efficiency",
  "variant": "capability",
  "configuration": "individual-capability",
  "timestamp": "2026-08-10T17:54:42.718Z",
  "environment": {
    "codex_cli": "codex-cli 0.146.0",
    "node": "v18.19.1",
    "platform": "linux-x64"
  },
  "metrics": {
    "input_tokens": 14628,
    "cached_input_tokens": 0,
    "output_tokens": 206,
    "total_tokens": 14834,
    "turns": 1,
    "tool_calls": 0,
    "latency_ms": 11822,
    "correction_turns": 0
  },
  "checks": [
    {
      "name": "output-schema",
      "passed": true,
      "detail": "response matches output schema"
    },
    {
      "name": "nonempty:decision",
      "passed": true,
      "detail": "decision is populated"
    },
    {
      "name": "nonempty:constraints",
      "passed": true,
      "detail": "constraints is populated"
    },
    {
      "name": "nonempty:verification",
      "passed": true,
      "detail": "verification is populated"
    },
    {
      "name": "nonempty:rollback",
      "passed": true,
      "detail": "rollback is populated"
    },
    {
      "name": "minimum-items:constraints",
      "passed": true,
      "detail": "constraints has 6 items"
    },
    {
      "name": "minimum-items:verification",
      "passed": true,
      "detail": "verification has 5 items"
    },
    {
      "name": "required-term:decision:retry worker",
      "passed": true,
      "detail": "decision includes retry worker"
    },
    {
      "name": "required-term:decision:retry table",
      "passed": true,
      "detail": "decision includes retry table"
    },
    {
      "name": "required-term:constraints:order_id",
      "passed": true,
      "detail": "constraints includes order_id"
    },
    {
      "name": "required-term:constraints:attempt",
      "passed": true,
      "detail": "constraints includes attempt"
    },
    {
      "name": "required-term:constraints:payment_retry_exhausted",
      "passed": true,
      "detail": "constraints includes payment_retry_exhausted"
    },
    {
      "name": "required-term:verification:30",
      "passed": true,
      "detail": "verification includes 30"
    },
    {
      "name": "required-term:verification:120",
      "passed": true,
      "detail": "verification includes 120"
    },
    {
      "name": "required-term:verification:600",
      "passed": true,
      "detail": "verification includes 600"
    },
    {
      "name": "required-term:verification:duplicate",
      "passed": true,
      "detail": "verification includes duplicate"
    },
    {
      "name": "required-term:verification:charge",
      "passed": true,
      "detail": "verification includes charge"
    },
    {
      "name": "required-term:verification:terminal",
      "passed": true,
      "detail": "verification includes terminal"
    },
    {
      "name": "required-term:rollback:payment_retry_v2",
      "passed": true,
      "detail": "rollback includes payment_retry_v2"
    }
  ],
  "passed": true,
  "response": {
    "decision": "Update only the existing payment retry worker to make three retry attempts using the existing retry table and durability boundary.",
    "constraints": [
      "Do not add a queue or database migration.",
      "Use retry delays of 30, 120, and 600 seconds; do not make a fourth attempt.",
      "Use `order_id` plus `attempt` as the idempotency key.",
      "Emit the existing `payment_retry_exhausted` metric after the terminal attempt; do not rename it.",
      "Preserve the current retry-table cleanup behavior.",
      "Exclude unrelated UI changes."
    ],
    "verification": [
      "Unit-test the retry delay schedule: 30, 120, and 600 seconds.",
      "Unit-test that processing terminates after the third attempt with no fourth attempt.",
      "Integration-test duplicate delivery and verify that exactly one charge occurs.",
      "Verify `payment_retry_exhausted` is emitted after the terminal attempt.",
      "Verify existing retry-table cleanup behavior remains unchanged."
    ],
    "rollback": "Disable the existing `payment_retry_v2` feature flag."
  }
}
